{
  "$schema": "https://json-schema.org/draft/2020-12/schema",
  "$id": "https://raw.githubusercontent.com/wilanis/wilanis-js/main/packages/core/schemas/plugin.schema.json",
  "title": "plugin",
  "description": "Native code, described: the settings a project may pass it, and what it grants -- ports (native), trigger kinds, connection kinds, codecs, shapes. Everything effectful enters through a grant. A plugin is an alias root: @http/http.port.json.",
  "type": "object",
  "properties": {
    "$schema": {
      "description": "The kind of this document: its published schema URL, or the alias @wilanis/plugin.schema.json.",
      "enum": [
        "https://raw.githubusercontent.com/wilanis/wilanis-js/main/packages/core/schemas/plugin.schema.json",
        "@wilanis/plugin.schema.json"
      ]
    },
    "description": {
      "description": "What this plugin is for, in one or two sentences, shown wherever a reader meets it.",
      "type": "string",
      "minLength": 1
    },
    "label": {
      "description": "A short human name for this document, shown wherever a reader sees it instead of its path. Absent: the file name stands in.",
      "type": "string",
      "minLength": 1
    },
    "settings": {
      "$ref": "common.schema.json#/$defs/inlineObject"
    },
    "grants": {
      "description": "What the plugin grants a tree: everything effectful enters through one of these, and each is a file under the plugin's docs/ that a reader can open.",
      "type": "object",
      "properties": {
        "ports": {
          "description": "The native ports it grants, by path. A tree names their operations from a graph and never binds them; the plugin implements them.",
          "type": "array",
          "items": {
            "$ref": "common.schema.json#/$defs/path"
          },
          "uniqueItems": true
        },
        "triggerKinds": {
          "description": "The trigger kinds it grants, by path. A trigger of one of these kinds fires a domain operation when something outside happens.",
          "type": "array",
          "items": {
            "$ref": "common.schema.json#/$defs/path"
          },
          "uniqueItems": true
        },
        "connectionKinds": {
          "description": "The connection kinds it grants, by path. A connection of one of these kinds says how to reach one outside system.",
          "type": "array",
          "items": {
            "$ref": "common.schema.json#/$defs/path"
          },
          "uniqueItems": true
        },
        "codecs": {
          "description": "The codecs it grants, by path. A codec reads a body into values and writes values back out.",
          "type": "array",
          "items": {
            "$ref": "common.schema.json#/$defs/path"
          },
          "uniqueItems": true
        },
        "shapes": {
          "description": "The shapes it grants, by path, for contracts and documents to name.",
          "type": "array",
          "items": {
            "$ref": "common.schema.json#/$defs/path"
          },
          "uniqueItems": true
        }
      },
      "additionalProperties": false
    },
    "requires": {
      "description": "What the plugin calls but does not implement: each is a file under the plugin's docs/, and the host binds it in a feature of its own, as it binds any domain port (B002 until it does).",
      "type": "object",
      "properties": {
        "ports": {
          "description": "The ports it requires, by path. The plugin calls their operations; a profile binds each to a binding the host writes. A path is granted or required, never both (D012).",
          "type": "array",
          "items": {
            "$ref": "common.schema.json#/$defs/path"
          },
          "uniqueItems": true
        }
      },
      "additionalProperties": false
    },
    "guard": {
      "description": "Declared by the one plugin that identifies callers. `credentials` are what it verifies -- token, challenge -- each with the type a trigger's policy attachment must give it and the context fields it yields once verified; `context` is what it adds to every trigger kind's context: context.principal, context.session, context.challenge, what policies and resolvers read. `refuses` lists the reasons it refuses with on its own (a credential that does not verify), each with what it means; a trigger giving a credential must map them (T005).",
      "type": "object",
      "properties": {
        "context": {
          "$ref": "common.schema.json#/$defs/inlineObject"
        },
        "refuses": {
          "description": "The reasons the guard refuses with on its own, by name, each with what it means. A trigger that gives it a credential must map them (T005).",
          "type": "object",
          "propertyNames": {
            "$ref": "common.schema.json#/$defs/ident"
          },
          "additionalProperties": {
            "type": "string"
          }
        },
        "credentials": {
          "description": "What the guard verifies, by name -- a token, a challenge -- each with the type a trigger's policy attachment must give it.",
          "type": "object",
          "propertyNames": {
            "$ref": "common.schema.json#/$defs/ident"
          },
          "additionalProperties": {
            "type": "object",
            "properties": {
              "type": {
                "$ref": "common.schema.json#/$defs/type"
              },
              "yields": {
                "description": "The context fields this credential yields once it verifies, which policies and resolvers may then read.",
                "type": "array",
                "items": {
                  "$ref": "common.schema.json#/$defs/ident"
                },
                "uniqueItems": true,
                "minItems": 1
              },
              "description": {
                "description": "What this credential is, for a reader deciding which one a trigger should hand over.",
                "type": "string"
              }
            },
            "required": [
              "type",
              "yields"
            ],
            "additionalProperties": false
          }
        }
      },
      "required": [
        "context",
        "credentials"
      ],
      "additionalProperties": false
    }
  },
  "required": [
    "$schema",
    "description",
    "grants"
  ],
  "additionalProperties": false
}
